{
  "schema_version": "2.0",
  "generated_at": "2026-09-15T05:35:00Z",
  "based_on_opportunities": {
    "file": "opportunites/2026/2026-W38.json"
  },
  "validations": [
    {
      "opportunity_id": "opp-2026-W38-01",
      "opportunity_title": "Haies : diagnostic et montage des dossiers du régime unique",
      "verdict": "signale_modere",
      "market_signal_strength": 3,
      "evidence": [
        {"type":"obligation","demand_signal":"direct","title":"Instruction du 17 juillet 2026 — déploiement du régime unique de la haie","summary":"L'instruction organise le guichet unique et la préparation préfectorale du régime applicable aux demandes à compter du 1er octobre 2026. Elle démontre un besoin opérationnel certain, sans prouver à elle seule l'achat d'une prestation externe.","url":"https://aida.ineris.fr/reglementation/instruction-170726-relative-regime-unique-haie","date":"2026-07-17","actor":"MTE / MASA / préfets"},
        {"type":"demande_explicite","demand_signal":"direct","title":"Morbihan — consultation départementale sur coefficient de compensation et période d'interdiction","summary":"Le département territorialise le régime unique avant son entrée en application. Cela confirme le travail d'instruction et de calibration locale, mais pas encore un marché d'ingénierie externalisé.","url":"https://www.morbihan.gouv.fr/Publications/Participation-du-public/Regime-unique-haie-Morbihan-Coefficient-de-compensation-et-periode-d-interdiction-Septembre-2026","date":"2026-09","actor":"Préfecture du Morbihan"},
        {"type":"demande_explicite","demand_signal":"direct","title":"Charente-Maritime — mise en place du régime unique haie","summary":"Consultation départementale préparant les paramètres locaux du régime unique. Le besoin réglementaire est confirmé dans plusieurs territoires ; l'externalisation vers des BE reste à mesurer.","url":"https://www.charente-maritime.gouv.fr/Actions-de-l-Etat/Environnement-risques-naturels-et-technologiques/Consultation-du-public-et-commissions-consultatives/Consultations-du-public/Autres-consultations-en-cours/Mise-en-place-du-regime-unique-haie-en-Charente-Maritime","date":"2026-09","actor":"Préfecture de Charente-Maritime"}
      ],
      "competitors_or_alternatives":["Chambres d'agriculture","BE écologie/TVB","Accompagnement direct DDT"],
      "economic_reading":"Le besoin réglementaire est certain et imminent, mais les recherches ne montrent pas encore une commande répétée de montage de dossiers par des BE. Le marché peut émerger rapidement sur les cas complexes espèces protégées/Natura 2000.",
      "recommended_next_step":"Préparer le produit interne et observer les premiers achats/dossiers externalisés après le 1er octobre avant de le classer prêt à prototyper commercialement."
    },
    {
      "opportunity_id":"opp-2026-W38-02","opportunity_title":"Restauration de la nature : diagnostics, objectifs territoriaux et suivi des restaurations","verdict":"signale_modere","market_signal_strength":3,
      "evidence":[
        {"type":"obligation","demand_signal":"indirect","title":"Règlement (UE) 2024/1991 relatif à la restauration de la nature","summary":"Le règlement crée des obligations de restauration et de planification nationales. Il rend le besoin technique durable mais ne démontre pas à lui seul l'externalisation territoriale française.","url":"https://eur-lex.europa.eu/legal-content/FR/ALL/?uri=OJ%3AL_202401991","date":"2024-07-29","actor":"Union européenne"},
        {"type":"autre","demand_signal":"indirect","title":"OFB — politiques et stratégies nationales de biodiversité","summary":"L'OFB documente les cadres nationaux de mise en œuvre et d'appui à la restauration. Signal institutionnel de capacité et de méthode, sans achat territorial explicite identifié.","url":"https://ofb.gouv.fr/les-politiques-et-strategies-nationales","date":"2026","actor":"OFB"},
        {"type":"financement","demand_signal":"direct","title":"IUCN — appui à l'élaboration du plan national français de restauration de la nature","summary":"Un appui technique financé au niveau européen est mobilisé pour l'élaboration du plan français. Cela confirme qu'une expertise spécialisée peut être financée, mais pas encore une vague de marchés territoriaux récurrents.","url":"https://iucn.org/fr/resources/brochure/appui-lelaboration-du-plan-national-francais-de-restauration-de-la-nature?language=fr","date":"2026","actor":"UICN / Union européenne"}
      ],
      "competitors_or_alternatives":["OFB/DREAL","Conservatoires et associations naturalistes","BE biodiversité/restauration"],
      "economic_reading":"La demande méthodologique est crédible et financée à l'échelle nationale, mais la recherche ne montre pas encore une vague d'achats territoriaux directement liée au NRP. Le sujet reste à préparer plutôt qu'à pousser commercialement.",
      "recommended_next_step":"Préparer une méthode de diagnostic/priorisation et revalider dès publication complète du plan français et apparition d'AAP/AO territoriaux."
    },
    {
      "opportunity_id":"opp-2026-W38-03","opportunity_title":"Eau : mesures de reliquats, diagnostics zones humides et programmation d'adaptation hydrique","verdict":"signale_fort","market_signal_strength":5,
      "evidence":[
        {"type":"appel_offres","demand_signal":"externalisable","title":"DREAL PACA — étude prospective Eau Sud 2050","summary":"Marché d'étude prospective sur les ressources en eau et transferts à l'horizon 2050, montrant l'achat public d'ingénierie d'adaptation hydrique.","url":"https://www.marchesonline.com/appels-offres/avis/etude-preliminaire-a-instauration-un-cadre-discussio/ao-9645759-1","date":"2026-08-15","actor":"DREAL Provence-Alpes-Côte d'Azur"},
        {"type":"appel_offres","demand_signal":"externalisable","title":"Eau 17 — étude d'opportunité et de préfaisabilité REUT sur 12 STEP littorales","summary":"Marché d'étude explicitement externalisé portant sur l'opportunité et la préfaisabilité de réutilisation des eaux usées traitées.","url":"https://www.marchesonline.com/appels-offres/avis/realisation-de-l-etude-d-opportunite-et-de-prefaisa/ao-9592001-1","date":"2026","actor":"Eau 17"},
        {"type":"appel_offres","demand_signal":"externalisable","title":"Vexin-Thelle — PGSSE, schéma de production et schéma directeur eau potable","summary":"Marché attribué regroupant plan de gestion de la sécurité sanitaire, schéma de production et schéma directeur, preuve d'une demande d'ingénierie structurée sur la résilience du service d'eau.","url":"https://www.marchesonline.com/appels-offres/attribution/realisation-d-un-plan-de-gestion-de-la-securite-sani/am-9593374-1","date":"2026","actor":"Communauté de communes du Vexin-Thelle"},
        {"type":"appel_offres","demand_signal":"externalisable","title":"Eau du Bassin Rennais — AMO pour le déploiement de la télérelève","summary":"Marché d'assistance à maîtrise d'ouvrage publié en septembre 2026, montrant l'externalisation de l'ingénierie de suivi et de gestion des consommations.","url":"https://www.marchesonline.com/appels-offres/avis/marche-d-assistance-a-maitrise-d-ouvrage-etude-de/ao-4321139-1","date":"2026-09-08","actor":"Collectivité Eau du Bassin Rennais"}
      ],
      "competitors_or_alternatives":["BE eau/hydraulique","Laboratoires agronomiques","Chambres d'agriculture","Grands opérateurs de l'eau"],
      "economic_reading":"La commande publique confirme un marché actif d'études de ressource, REUT, schémas directeurs et AMO. Le sous-segment reliquats reste partagé avec les laboratoires, mais l'ingénierie eau/adaptation est clairement externalisée.",
      "recommended_next_step":"Prototyper une offre BE centrée sur diagnostic ressource + programme d'adaptation, avec module zones humides/IOTA et partenariats laboratoire lorsque des campagnes analytiques sont nécessaires."
    },
    {
      "opportunity_id":"opp-2026-W38-04","opportunity_title":"PFAS : plan d'autosurveillance, campagnes eaux/boues et stratégie de filière","verdict":"signale_fort","market_signal_strength":5,
      "evidence":[
        {"type":"appel_offres","demand_signal":"externalisable","title":"Perpignan Méditerranée Métropole — mesures réglementaires PFAS sur eaux et boues de STEP","summary":"Marché explicitement consacré aux mesures réglementaires PFAS sur stations d'épuration, incluant eaux et boues : preuve directe d'achat de prestation.","url":"https://www.marchesonline.com/appels-offres/avis/realisation-de-mesures-reglementaires-pfas-sur-les-st/ao-9636414-1","date":"2026-07-17","actor":"Perpignan Méditerranée Métropole"},
        {"type":"appel_offres","demand_signal":"externalisable","title":"Région Grand Est — stations mobiles de traitement PFAS","summary":"Accord-cadre pour acquisition et exploitation de stations mobiles de traitement, montrant la monétisation de solutions PFAS au-delà de la seule analyse.","url":"https://www.marchesonline.com/appels-offres/avis/acquisition-et-exploitation-de-stations-mobiles-de-trai/ao-9626410-1","date":"2026-07","actor":"Région Grand Est","amount_or_scale":"2,43 M€ HT max / 48 mois"},
        {"type":"appel_offres","demand_signal":"externalisable","title":"CAPI — installation et suivi d'une unité pilote de traitement PFAS","summary":"Marché portant sur une unité pilote et son suivi sur des captages, confirmant un besoin d'essais, de suivi et d'aide à la décision.","url":"https://www.marchesonline.com/appels-offres/avis/installation-et-suivi-d-une-unite-pilote-pour-le-traite/ao-9640219-1","date":"2026","actor":"CAPI"},
        {"type":"obligation","demand_signal":"indirect","title":"Arrêté du 1er septembre 2026 — exemption TGAP pour les boues d'épuration contaminées aux PFAS","summary":"Le texte facilite l'orientation des boues contaminées vers des filières d'élimination adaptées et ajoute un maillon économique à la chaîne de conformité.","url":"https://www.actu-environnement.com/ae/reglementation/arrete-du-01-09-2026-tecp2621924a-40270.php","date":"2026-09-06","actor":"État"}